[
  {
    "id": "cir.s.admonition",
    "name": "Admonition",
    "text": "A model of her battlegroup gets a warning ward. The first time an enemy ends a move or is placed within 6 inches of it, the model may advance up to 3 inches at once, then the spell ends. Upkeep.",
    "cost": 2,
    "rng": 6,
    "dur": "UP",
    "offensive": false,
    "effect": [
      {
        "code": "cirAdmonition"
      }
    ],
    "scope": {
      "who": "battlegroup"
    },
    "verify": "Scope battlegroup (spells.ts): Tanith or any warbeast she controls. Core: afterPlacement raises the ward move (admonitionReady) after an enemy move; the ward ends once it has fired. Card (S1): COST 2, RNG 6, UP, OFF No."
  },
  {
    "id": "cir.s.affliction",
    "name": "Affliction",
    "text": "An enemy model gets -2 DEF, and a direct-hit damage roll against it that fails to beat its ARM still deals 1 damage. Upkeep.",
    "cost": 2,
    "rng": 8,
    "pow": 0,
    "dur": "UP",
    "offensive": true,
    "effect": [
      {
        "op": "modStat",
        "stat": "DEF",
        "value": -2
      },
      {
        "code": "cirAffliction"
      }
    ],
    "scope": {
      "who": "enemy"
    },
    "verify": "Offensive with no POW: the cast is an attack roll that rolls no damage; on a hit cirAffliction puts the upkeep effect (-2 DEF, 1-damage floor via afflictionFloor() in the damage roll) on the model hit. Cast on a model of a unit it is the unit form: the one attack roll is made at the model chosen and a hit lands the effect (one upkeep) on every model of that unit; any other model gets it alone. Card (S1): COST 2, RNG 8, UP, OFF Yes, target model or unit."
  },
  {
    "id": "cir.s.rift",
    "name": "Rift",
    "text": "An arcane attack on one model. On a direct hit, a 3 inch area around it becomes rough terrain for a round. Nothing else in the area is damaged.",
    "cost": 3,
    "rng": 10,
    "aoe": 3,
    "pow": 13,
    "dur": "RND",
    "offensive": true,
    "effect": [
      {
        "code": "cirRift"
      }
    ],
    "scope": {
      "who": "enemy"
    },
    "verify": "Core: cirRift adds a temporary rough piece (props.tempRound); housekeeping removes it when the round passes. Card (S1): COST 3, RNG 10, AOE -, POW 13, DUR *, OFF Yes; the 3 inch rough area is the one its text places, not a blast."
  },
  {
    "id": "cir.s.scything-touch",
    "name": "Scything Touch",
    "text": "A friendly Faction model is wrapped in a dark shroud: enemy models within 2 inches of it get -2 ARM. Upkeep.",
    "cost": 2,
    "rng": 6,
    "dur": "UP",
    "offensive": false,
    "effect": [
      {
        "code": "cirScythingTouch"
      }
    ],
    "scope": {
      "who": "friendly"
    },
    "verify": "Core: statOf adds scythingTouchArmPenalty() to ARM. Card (S1): COST 2, RNG 6, UP, OFF No."
  },
  {
    "id": "cir.s.veil-of-mists",
    "name": "Veil of Mists",
    "text": "A 3 inch cloud forms in her CTRL. Friendly Faction models can see through it, and inside it they gain Pathfinder and can pass through obstructions and models they can clear. Upkeep.",
    "cost": 2,
    "rng": "CTRL",
    "aoe": 3,
    "dur": "UP",
    "offensive": false,
    "effect": [
      {
        "op": "cloud",
        "aoe": 3,
        "placement": "ctrl",
        "blocksLos": false
      },
      {
        "code": "cirVeilOfMists"
      }
    ],
    "scope": {
      "who": "friendly",
      "range": "CTRL"
    },
    "verify": "RULING: the cloud is placed toward the nearest enemy (no point choice). Core: friendly-only transparency (cloud.friendlyTransparent) and Pathfinder plus ghostly movement inside. Card (S1): COST 2, RNG CTRL, AOE -, UP, OFF No; the cloud is the standard 3 inch cloud (rulebook p98)."
  },
  {
    "id": "cir.s.wraithbane",
    "name": "Wraithbane",
    "text": "Animus. A friendly Faction model's weapons gain Blessed and deal magical damage for a turn.",
    "cost": 2,
    "rng": 6,
    "dur": "TURN",
    "offensive": false,
    "animus": true,
    "effect": [
      {
        "code": "cirWraithbane"
      }
    ],
    "scope": {
      "who": "friendly"
    },
    "verify": "Blessed is applied by the Wraithbane Weapons ability on the attacker; core adds the magical damage type while the animus is on the attacker. Card (S1): COST 2, RNG 6, DUR Turn, OFF No."
  },
  {
    "id": "cir.s.doppler-bark",
    "name": "Doppler Bark",
    "text": "Animus. Living and undead enemy models within 2 inches of the caster have their base DEF dropped to 5 and cannot run, charge, slam or trample for a round.",
    "cost": 2,
    "rng": "SELF",
    "dur": "RND",
    "offensive": false,
    "animus": true,
    "effect": [
      {
        "code": "cirDopplerBark"
      }
    ],
    "scope": {
      "who": "self"
    },
    "verify": "App card (S1, S2, S10 agree): COST 2, RNG Self, DUR Rnd, OFF No, 2 inch reach. Core does not yet stop run, charge, slam or trample from a forbid list (only a frenzied beast's charge reads it); DEF 5 works."
  }
]
